{
  "$schema": "http://json-schema.org/draft-07/schema#",
  "title": "Application Configuration Schema",
  "type": "object",
  "properties": {
    "database_url": {
      "type": "string",
      "format": "uri",
      "description": "URL for the database connection."
    },
    "api_key": {
      "type": "string",
      "description": "API key for accessing external services."
    },
    "debug": {
      "type": "boolean",
      "description": "Flag to enable or disable debug mode."
    },
    "execution_mode": {
      "type": "string",
      "enum": ["ray", "thread"],
      "description": "Execution mode, either 'ray' for distributed execution or 'thread' for local threading."
    },
    "polyfem_mode": {
      "type": "string",
      "enum": ["docker", "local"],
      "description": "Polyfem execution mode, either 'docker' or 'local'."
    },
    "polyfem": {
      "type": "object",
      "properties": {
        "docker_image": {
          "type": "string",
          "description": "Docker image name for Polyfem, required if polyfem_mode is 'docker'."
        },
        "local_executable_path": {
          "type": "string",
          "description": "Path to the local Polyfem executable, required if polyfem_mode is 'local'."
        },
        "shared_volume": {
          "type": "string",
          "description": "Optional shared volume directory for Docker mode."
        },
        "docker_network": {
          "type": "string",
          "description": "Optional Docker network configuration."
        }
      },
      "additionalProperties": false
    },
    "minio": {
      "type": "object",
      "properties": {
        "MINIO_ROOT_USER": {
          "type": "string",
          "description": "Root username for MinIO."
        },
        "MINIO_ROOT_PASSWORD": {
          "type": "string",
          "description": "Root password for MinIO."
        },
        "MINIO_PROMETHEUS_AUTH_TYPE": {
          "type": "string",
          "enum": ["public", "private"],
          "description": "Authentication type for MinIO Prometheus."
        }
      },
      "required": ["MINIO_ROOT_USER", "MINIO_ROOT_PASSWORD", "MINIO_PROMETHEUS_AUTH_TYPE"],
      "additionalProperties": false
    },
    "zookeeper": {
      "type": "object",
      "properties": {
        "ZOOKEEPER_CLIENT_PORT": {
          "type": "integer",
          "minimum": 1,
          "maximum": 65535,
          "description": "Client port for Zookeeper."
        },
        "ZOOKEEPER_TICK_TIME": {
          "type": "integer",
          "minimum": 1,
          "description": "Tick time for Zookeeper in milliseconds."
        }
      },
      "required": ["ZOOKEEPER_CLIENT_PORT", "ZOOKEEPER_TICK_TIME"],
      "additionalProperties": false
    },
    "kafka": {
      "type": "object",
      "properties": {
        "KAFKA_BROKER_ID": {
          "type": "integer",
          "minimum": 1,
          "description": "Broker ID for Kafka."
        },
        "KAFKA_ZOOKEEPER_CONNECT": {
          "type": "string",
          "format": "uri",
          "description": "Zookeeper connection string for Kafka."
        },
        "KAFKA_ADVERTISED_LISTENERS": {
          "type": "string",
          "pattern": "^PLAINTEXT://[\\w.-]+:\\d+$",
          "description": "Advertised listeners for Kafka."
        },
        "KAFKA_OFFSETS_TOPIC_REPLICATION_FACTOR": {
          "type": "integer",
          "minimum": 1,
          "description": "Replication factor for Kafka offsets topic."
        }
      },
      "required": [
        "KAFKA_BROKER_ID",
        "KAFKA_ZOOKEEPER_CONNECT",
        "KAFKA_ADVERTISED_LISTENERS",
        "KAFKA_OFFSETS_TOPIC_REPLICATION_FACTOR"
      ],
      "additionalProperties": false
    },
    "mongo": {
      "type": "object",
      "properties": {
        "MONGO_INITDB_ROOT_USERNAME": {
          "type": "string",
          "description": "Root username for MongoDB."
        },
        "MONGO_INITDB_ROOT_PASSWORD": {
          "type": "string",
          "description": "Root password for MongoDB."
        }
      },
      "required": ["MONGO_INITDB_ROOT_USERNAME", "MONGO_INITDB_ROOT_PASSWORD"],
      "additionalProperties": false
    },
    "qdrant": {
      "type": "object",
      "properties": {
        "QDRANT__SERVICE__HTTP_PORT": {
          "type": "integer",
          "minimum": 1,
          "maximum": 65535,
          "description": "HTTP port for Qdrant service."
        },
        "QDRANT__COLLECTIONS__DEFAULT__NAME": {
          "type": "string",
          "description": "Default collection name for Qdrant."
        }
      },
      "required": ["QDRANT__SERVICE__HTTP_PORT", "QDRANT__COLLECTIONS__DEFAULT__NAME"],
      "additionalProperties": false
    },
    "grafana": {
      "type": "object",
      "properties": {
        "GF_SECURITY_ADMIN_USER": {
          "type": "string",
          "description": "Admin username for Grafana."
        },
        "GF_SECURITY_ADMIN_PASSWORD": {
          "type": "string",
          "description": "Admin password for Grafana."
        }
      },
      "required": ["GF_SECURITY_ADMIN_USER", "GF_SECURITY_ADMIN_PASSWORD"],
      "additionalProperties": false
    },
    "simulation": {
      "type": "object",
      "properties": {
        "dt": {
          "type": "array",
          "items": {
            "type": "number",
            "minimum": 0.0001
          },
          "minItems": 1,
          "description": "List of time step sizes for the simulation."
        },
        "tend": {
          "type": "array",
          "items": {
            "type": "number",
            "minimum": 0.1
          },
          "minItems": 1,
          "description": "List of end times for simulations."
        },
        "materials": {
          "type": "object",
          "properties": {
            "poisson_ratios": {
              "type": "array",
              "items": {
                "type": "number",
                "minimum": 0,
                "maximum": 0.5
              },
              "minItems": 1,
              "description": "List of Poisson's ratios for materials."
            },
            "young_moduli": {
              "type": "array",
              "items": {
                "type": "number",
                "minimum": 0
              },
              "minItems": 1,
              "description": "List of Young's moduli for materials."
            },
            "densities": {
              "type": "array",
              "items": {
                "type": "number",
                "minimum": 0
              },
              "minItems": 1,
              "description": "List of densities for materials."
            }
          },
          "required": ["poisson_ratios", "young_moduli", "densities"],
          "additionalProperties": false
        },
        "linear_strings": {
          "type": "array",
          "items": {
            "type": "string"
          },
          "description": "List of linear strings for simulation parameters or identifiers."
        },
        "models": {
          "type": "object",
          "properties": {
            "model_type_a": {
              "type": "array",
              "items": {
                "type": "string"
              },
              "minItems": 1,
              "description": "List of Model Type A identifiers or descriptions."
            },
            "model_type_b": {
              "type": "array",
              "items": {
                "type": "string"
              },
              "minItems": 1,
              "description": "List of Model Type B identifiers or descriptions."
            }
          },
          "required": ["model_type_a", "model_type_b"],
          "additionalProperties": false
        },
        "apply_force": {
          "type": "array",
          "items": {
            "type": "number",
            "minimum": 0
          },
          "description": "List of force magnitudes to apply in the simulation."
        },
        "movement_types": {
          "type": "array",
          "items": {
            "type": "string"
          },
          "description": "List of movement type identifiers or descriptions."
        }
      },
      "required": ["dt", "tend", "materials", "linear_strings", "models", "apply_force", "movement_types"],
      "additionalProperties": false
    }
  },
  "required": [
    "database_url",
    "api_key",
    "debug",
    "execution_mode",
    "polyfem_mode",
    "polyfem",
    "minio",
    "zookeeper",
    "kafka",
    "mongo",
    "qdrant",
    "grafana",
    "simulation"
  ],
  "additionalProperties": false
}
