{
  "database_url": "postgresql://localhost:5432/mydb",
  "api_key": "abcdef123456",
  "debug": true,
  "execution_mode": "ray",
  "polyfem_mode": "docker",
  "polyfem": {
    "docker_image": "polyfem/polyfem:latest",
    "local_executable_path": "/path/to/polyfem",
    "shared_volume": "/data/polyfem",
    "docker_network": "host"
  },
  "minio": {
    "MINIO_ROOT_USER": "minioadmin",
    "MINIO_ROOT_PASSWORD": "minioadmin",
    "MINIO_PROMETHEUS_AUTH_TYPE": "public"
  },
  "zookeeper": {
    "ZOOKEEPER_CLIENT_PORT": 2181,
    "ZOOKEEPER_TICK_TIME": 2000
  },
  "kafka": {
    "KAFKA_BROKER_ID": 1,
    "KAFKA_ZOOKEEPER_CONNECT": "http://zookeeper:2181",
    "KAFKA_ADVERTISED_LISTENERS": "PLAINTEXT://localhost:9092",
    "KAFKA_OFFSETS_TOPIC_REPLICATION_FACTOR": 1
  },
  "mongo": {
    "MONGO_INITDB_ROOT_USERNAME": "root",
    "MONGO_INITDB_ROOT_PASSWORD": "example"
  },
  "qdrant": {
    "QDRANT__SERVICE__HTTP_PORT": 6333,
    "QDRANT__COLLECTIONS__DEFAULT__NAME": "default"
  },
  "grafana": {
    "GF_SECURITY_ADMIN_USER": "admin",
    "GF_SECURITY_ADMIN_PASSWORD": "admin"
  },
  "simulation": {
    "dt": [0.01, 0.02, 0.05],
    "tend": [10.0, 20.0],
    "materials": {
      "poisson_ratios": [0.3, 0.25],
      "young_moduli": [200000000000, 150000000000],
      "densities": [7850, 2700]
    },
    "linear_strings": ["param1", "param2", "param3"],
    "models": {
      "model_type_a": ["ModelA1", "ModelA2"],
      "model_type_b": ["ModelB1", "ModelB2"]
    },
    "apply_force": [100.0, 150.0, 200.0],
    "movement_types": ["linear", "rotational"]
  }
}
